title,date,category,link
Owner Of Marketing Companies And DME Company Convicted For Role In $100 Million Scheme To Defraud Medicare And Other Insurers And To Violate The Anti-Kickback Statute,2025-03-06,Criminal and Civil Actions,https://oig.hhs.gov/fraud/enforcement/owner-of-marketing-companies-and-dme-company-convicted-for-role-in-100-million-scheme-to-defraud-medicare-and-other-insurers-and-to-violate-the-anti-kickback-statute/
Medical Billing Company Owner Sentenced For Health Care Fraud,2025-03-06,Criminal and Civil Actions,https://oig.hhs.gov/fraud/enforcement/medical-billing-company-owner-sentenced-for-health-care-fraud/
"Lake Charles Physician, Wife, And Clinic Agree To Pay Medicare For Improper Billing Related To Implanted Neurostimulators",2025-03-06,Criminal and Civil Actions,https://oig.hhs.gov/fraud/enforcement/lake-charles-physician-wife-and-clinic-agree-to-pay-medicare-for-improper-billing-related-to-implanted-neurostimulators/
Health Care Providers And Laboratory Marketers Agree To Pay Over $1.9 Million To Settle Kickback Allegations,2025-03-06,Criminal and Civil Actions,https://oig.hhs.gov/fraud/enforcement/health-care-providers-and-laboratory-marketers-agree-to-pay-over-19-million-to-settle-kickback-allegations/
"Addiction Treatment Center Supervisor Sentenced in Scheme to Defraud Federal, State, and Private Health Care Insurers",2025-03-05,Criminal and Civil Actions,https://oig.hhs.gov/fraud/enforcement/addiction-treatment-center-supervisor-sentenced-in-scheme-to-defraud-federal-state-and-private-health-care-insurers/
Buffalo Business Owner Sentenced For Medicaid Fraud,2025-03-05,Criminal and Civil Actions,https://oig.hhs.gov/fraud/enforcement/buffalo-business-owner-sentenced-for-medicaid-fraud/
The New Mexico Department Of Justice Charges Nancy Marshall With 18 Felony Counts Related To Fraudulent Medicaid Claims Totaling Nearly $1 Million,2025-03-05,State Enforcement Agencies,https://oig.hhs.gov/fraud/enforcement/the-new-mexico-department-of-justice-charges-nancy-marshall-with-18-felony-counts-related-to-fraudulent-medicaid-claims-totaling-nearly-1-million/
Walgreens Agrees To Pay Nearly $98 Million To Resolve Allegations It Billed The Government For Uncollected Prescriptions,2025-03-04,State Enforcement Agencies,https://oig.hhs.gov/fraud/enforcement/walgreens-agrees-to-pay-nearly-98-million-to-resolve-allegations-it-billed-the-government-for-uncollected-prescriptions/
Parkville Woman Pleads Guilty To Over $3.6 Million In Medicaid Fraud,2025-03-04,State Enforcement Agencies,https://oig.hhs.gov/fraud/enforcement/parkville-woman-pleads-guilty-to-over-36-million-in-medicaid-fraud/
Attorney General Alan Wilson Announces Former Assisted Living Facility Employee Sent To Prison For Stealing From Resident,2025-03-04,State Enforcement Agencies,https://oig.hhs.gov/fraud/enforcement/attorney-general-alan-wilson-announces-former-assisted-living-facility-employee-sent-to-prison-for-stealing-from-resident/
Madison County Man Faces Charges Of Financial Exploitation Of Vulnerable Adults,2025-03-04,State Enforcement Agencies,https://oig.hhs.gov/fraud/enforcement/madison-county-man-faces-charges-of-financial-exploitation-of-vulnerable-adults/
Harrisburg Woman Sentenced To 41 Months in Prison for Health Care Fraud And Bank Fraud Charges,2025-03-03,Criminal and Civil Actions,https://oig.hhs.gov/fraud/enforcement/harrisburg-woman-sentenced-to-41-months-in-prison-for-health-care-fraud-and-bank-fraud-charges/
"Friendly Medical Transport Agreed to Pay $119,000 for Allegedly Violating the Civil Monetary Penalties Law by Submitting Claims for Mileage Greater Than Provided",2025-03-03,Fraud Self-Disclosures,https://oig.hhs.gov/fraud/enforcement/friendly-medical-transport-agreed-to-pay-119000-for-allegedly-violating-the-civil-monetary-penalties-law-by-submitting-claims-for-mileage-greater-than-provided/
Attorney General Ken Paxton’s Investigation Leads To 10-Year Prison Sentence And Over $26 Million In Restitution For Texas Doctor,2025-03-03,State Enforcement Agencies,https://oig.hhs.gov/fraud/enforcement/attorney-general-ken-paxtons-investigation-leads-to-10-year-prison-sentence-and-over-26-million-in-restitution-for-texas-doctor/
Attorney General Coleman Announces Medicaid Felony Indictments For Five In Louisville,2025-03-03,State Enforcement Agencies,https://oig.hhs.gov/fraud/enforcement/attorney-general-coleman-announces-medicaid-felony-indictments-for-five-in-louisville/
Owner of Oahu Physical Therapy Clinic Sentenced to 9 Months in Federal Prison for Health Care Fraud,2025-02-28,Criminal and Civil Actions,https://oig.hhs.gov/fraud/enforcement/owner-of-oahu-physical-therapy-clinic-sentenced-to-9-months-in-federal-prison-for-health-care-fraud/
"Acting United States Attorney Fondren Announces Federal Indictment Against Gynecologist for Sexually Abusing Patients, Adulterating Medical Devices for Reuse on Patients, and Healthcare Fraud",2025-02-28,Criminal and Civil Actions,https://oig.hhs.gov/fraud/enforcement/acting-united-states-attorney-fondren-announces-federal-indictment-against-gynecologist-for-sexually-abusing-patients-adulterating-medical-devices-for-reuse-on-patients-and-healthcare-fraud/
"Community Health Care Solutions, LLC and the Estate of Yolanda Burnom Agree to Pay $4.6 Million in Medicaid Fraud Lawsuit",2025-02-27,Criminal and Civil Actions,https://oig.hhs.gov/fraud/enforcement/community-health-care-solutions-llc-and-the-estate-of-yolanda-burnom-agree-to-pay-46-million-in-medicaid-fraud-lawsuit/
"Ascension Resurrection Agreed to Pay $133,420 for Allegedly Violating Patient Dumping Statute by Failing to Provide Appropriate Medical Screening Examination",2025-02-26,CMP and Affirmative Exclusions,https://oig.hhs.gov/fraud/enforcement/ascension-resurrection-agreed-to-pay-133420-for-allegedly-violating-patient-dumping-statute-by-failing-to-provide-appropriate-medical-screening-examination/
Woman Previously Convicted of Fraud and Identity Theft Offenses Sentenced to Additional Prison Time for Violating Supervised Release Conditions,2025-02-26,Criminal and Civil Actions,https://oig.hhs.gov/fraud/enforcement/woman-previously-convicted-of-fraud-and-identity-theft-offenses-sentenced-to-additional-prison-time-for-violating-supervised-release-conditions/
"Essex County Man Convicted, Sentenced After Trial For Submitting False MassHealth Claims For Autism Behavioral Health Treatment",2025-02-26,State Enforcement Agencies,https://oig.hhs.gov/fraud/enforcement/essex-county-man-convicted-sentenced-after-trial-for-submitting-false-masshealth-claims-for-autism-behavioral-health-treatment/
Former Director of Tuscola County Peer Center Charged with Embezzling from Center,2025-02-26,State Enforcement Agencies,https://oig.hhs.gov/fraud/enforcement/former-director-of-tuscola-county-peer-center-charged-with-embezzling-from-center/
National Sales Director for New York-Based Mobile Diagnostic Company Charged in Kickback Scheme,2025-02-25,Criminal and Civil Actions,https://oig.hhs.gov/fraud/enforcement/national-sales-director-for-new-york-based-mobile-diagnostic-company-charged-in-kickback-scheme/
"United States Sues Skilled Nursing Company, Executives and Consultant for Fraudulent Billing",2025-02-25,Criminal and Civil Actions,https://oig.hhs.gov/fraud/enforcement/united-states-sues-skilled-nursing-company-executives-and-consultant-for-fraudulent-billing/
Danville Woman Pleads Guilty to Health Care Fraud,2025-02-25,Criminal and Civil Actions,https://oig.hhs.gov/fraud/enforcement/danville-woman-pleads-guilty-to-health-care-fraud/
Lab Operator Convicted of $4M Medicare Fraud Scheme,2025-02-25,Criminal and Civil Actions,https://oig.hhs.gov/fraud/enforcement/lab-operator-convicted-of-4m-medicare-fraud-scheme/
"Jeffersonville Resident Sentenced For Medicaid Fraud, Driving Under The Influence, And Abuse Of A Vulnerable Adult",2025-02-25,State Enforcement Agencies,https://oig.hhs.gov/fraud/enforcement/attorney-general-james-announces-guilty-verdict-of-physician-who-subjected-patients-to-unnecessary-and-invasive-tests-1/
Pittsford Resident Arraigned for Neglect of a Vulnerable Adult and Medicaid Fraud,2025-02-25,State Enforcement Agencies,https://oig.hhs.gov/fraud/enforcement/pittsford-resident-arraigned-for-neglect-of-a-vulnerable-adult-and-medicaid-fraud/
"Eureka Chiropractor Convicted of Defrauding Medicare, Insurance Companies Out of More Than $1.5 Million",2025-02-24,Criminal and Civil Actions,https://oig.hhs.gov/fraud/enforcement/eureka-chiropractor-convicted-of-defrauding-medicare-insurance-companies-out-of-more-than-15-million/
North Haven Counselor Sentenced to More Than 3 Years in Federal Prison for Defrauding Medicaid of More Than $1.6 Million,2025-02-24,Criminal and Civil Actions,https://oig.hhs.gov/fraud/enforcement/north-haven-counselor-sentenced-to-more-than-3-years-in-federal-prison-for-defrauding-medicaid-of-more-than-16-million/
"Benedictine Living Community Crookston Agreed to Pay $247,000 for Allegedly Violating the Civil Monetary Penalties Law by Employing an Excluded Individual",2025-02-24,Fraud Self-Disclosures,https://oig.hhs.gov/fraud/enforcement/benedictine-living-community-crookston-agreed-to-pay-247000-for-allegedly-violating-the-civil-monetary-penalties-law-by-employing-an-excluded-individual/
Arizona Man Charged With Conspiracy To Commit Bank Fraud And Theft Of $1 Million In Federal Grants For HIV Programs,2025-02-21,Criminal and Civil Actions,https://oig.hhs.gov/fraud/enforcement/arizona-man-charged-with-conspiracy-to-commit-bank-fraud-and-theft-of-1-million-in-federal-grants-for-hiv-programs/
"Ohio doctor agrees to pay $600,000 to settle False Claims Act allegations",2025-02-21,Criminal and Civil Actions,https://oig.hhs.gov/fraud/enforcement/ohio-doctor-agrees-to-pay-600000-to-settle-false-claims-act-allegations/
Saad Healthcare Agrees to Pay $3M to Settle False Claims Act Allegations That It Billed Medicare for Ineligible Hospice Patients,2025-02-21,Criminal and Civil Actions,https://oig.hhs.gov/fraud/enforcement/saad-healthcare-agrees-to-pay-3m-to-settle-false-claims-act-allegations-that-it-billed-medicare-for-ineligible-hospice-patients/
"Baptist Medical Center South Agreed to Pay $290,000 for Allegedly Violating Patient Dumping Statute by Failing to Provide Appropriate Medical Screening Examinations and Stabilizing Treatment",2025-02-20,CMP and Affirmative Exclusions,https://oig.hhs.gov/fraud/enforcement/baptist-medical-center-south-agreed-to-pay-290000-for-allegedly-violating-patient-dumping-statute-by-failing-to-provide-appropriate-medical-screening-examinations-and-stabilizing-treatment/
Owner of Durable Medical Equipment Companies Charged in Nearly $30 Million Fraud Scheme,2025-02-20,Criminal and Civil Actions,https://oig.hhs.gov/fraud/enforcement/owner-of-durable-medical-equipment-companies-charged-in-nearly-30-million-fraud-scheme/
Law Enforcement Seizes Range Rover and Over $4 Million in Health Care Fraud Proceeds from Miami Couple Charged with Health Care Fraud and Money Laundering Conspiracies,2025-02-20,Criminal and Civil Actions,https://oig.hhs.gov/fraud/enforcement/law-enforcement-seizes-range-rover-and-over-4-million-in-health-care-fraud-proceeds-from-miami-couple-charged-with-health-care-fraud-and-money-laundering-conspiracies/
Columbia Physician Pleads Guilty to False Statements to Medicare,2025-02-20,Criminal and Civil Actions,https://oig.hhs.gov/fraud/enforcement/columbia-physician-pleads-guilty-to-false-statements-to-medicare/
"Former Taney County Official Pleads Guilty to Stealing $260,000",2025-02-20,Criminal and Civil Actions,https://oig.hhs.gov/fraud/enforcement/former-taney-county-official-pleads-guilty-to-stealing-260000/
Vice President of Health Care Software and Services Company Pleads Guilty to $1B Health Care Fraud Conspiracy,2025-02-20,Criminal and Civil Actions,https://oig.hhs.gov/fraud/enforcement/vice-president-of-health-care-software-and-services-company-pleads-guilty-to-1b-health-care-fraud-conspiracy/
"South Pacific Rehabilitation Services Agreed to Pay $201,000 for Allegedly Violating the Civil Monetary Penalties Law by Employing an Excluded Individual",2025-02-20,Fraud Self-Disclosures,https://oig.hhs.gov/fraud/enforcement/south-pacific-rehabilitation-services-agreed-to-pay-201000-for-allegedly-violating-the-civil-monetary-penalties-law-by-employing-an-excluded-individual/
Suburban Chicago Man Sentenced To More Than Five Years In Prison For $1.5 Million COVID-Relief Fraud,2025-02-19,COVID-19,https://oig.hhs.gov/fraud/enforcement/suburban-chicago-man-sentenced-to-more-than-five-years-in-prison-for-15-million-covid-relief-fraud/
St. Louis Area Doctor Sentenced for Health Care Fraud,2025-02-19,Criminal and Civil Actions,https://oig.hhs.gov/fraud/enforcement/st-louis-area-doctor-sentenced-for-health-care-fraud/
President of Insurance Brokerage Firm and CEO of Marketing Company Charged in $161M Affordable Care Act Enrollment Fraud Scheme,2025-02-19,Criminal and Civil Actions,https://oig.hhs.gov/fraud/enforcement/president-of-insurance-brokerage-firm-and-ceo-of-marketing-company-charged-in-161m-affordable-care-act-enrollment-fraud-scheme/
Med One Mobile and Gregory Wireman Agreed to Be Excluded for 5 Years for Submitting Claims for Medically Unnecessary Ambulance Transportation Services,2025-02-14,CMP and Affirmative Exclusions,https://oig.hhs.gov/fraud/enforcement/med-one-mobile-and-gregory-wireman-agreed-to-be-excluded-for-5-years-for-submitting-claims-for-medically-unnecessary-ambulance-transportation-services/
Carbon County Man Pleads No Contest to Posing as Medical Professional to Prescribe Medications and Provide Care to Obtain Insurance Reimbursements,2025-02-14,State Enforcement Agencies,https://oig.hhs.gov/fraud/enforcement/carbon-county-man-pleads-no-contest-to-posing-as-medical-professional-to-prescribe-medications-and-provide-care-to-obtain-insurance-reimbursements/
"York County Couple — Exercising Power of Attorney and Primary Caregiving Responsibilities — Charged with Neglect, Financial Exploitation of Elderly Woman",2025-02-14,State Enforcement Agencies,https://oig.hhs.gov/fraud/enforcement/york-county-couple-exercising-power-of-attorney-and-primary-caregiving-responsibilities-charged-with-neglect-financial-exploitation-of-elderly-woman/
Two Pharmacists Convicted for Illegal Distribution of Oxycodone,2025-02-12,Criminal and Civil Actions,https://oig.hhs.gov/fraud/enforcement/two-pharmacists-convicted-for-illegal-distribution-of-oxycodone/
AG Fitch Announces Settlement in Medicaid Fraud Case,2025-02-12,State Enforcement Agencies,https://oig.hhs.gov/fraud/enforcement/ag-fitch-announces-settlement-in-medicaid-fraud-case/
Doctor Convicted of $24M Medicare Fraud Scheme,2025-02-11,Criminal and Civil Actions,https://oig.hhs.gov/fraud/enforcement/doctor-convicted-of-24m-medicare-fraud-scheme/
Attorney General Marshall Announces the Conviction of Former Birmingham Nurse for Theft of Opioid Tablets,2025-02-11,State Enforcement Agencies,https://oig.hhs.gov/fraud/enforcement/attorney-general-marshall-announces-the-conviction-of-former-birmingham-nurse-for-theft-of-opioid-tablets/
"Glens Falls Hospital Agreed to Pay $204,000 for Allegedly Violating the Civil Monetary Penalties Law by Submitting Claims for Services that Did Not Meet Coverage Requirements",2025-02-07,Fraud Self-Disclosures,https://oig.hhs.gov/fraud/enforcement/glens-falls-hospital-agreed-to-pay-204000-for-allegedly-violating-the-civil-monetary-penalties-law-by-submitting-claims-for-services-that-did-not-meet-coverage-requirements/
"Four Pharmacists Sentenced for Roles in $13M Medicare, Medicaid, and Private Insurer Fraud Conspiracy",2025-02-06,Criminal and Civil Actions,https://oig.hhs.gov/fraud/enforcement/four-pharmacists-sentenced-for-roles-in-13m-medicare-medicaid-and-private-insurer-fraud-conspiracy/
Louisiana Doctor Sentenced for Illegally Distributing Over 1.8M Doses of Opioids in $5.4M Health Care Fraud Scheme,2025-02-06,Criminal and Civil Actions,https://oig.hhs.gov/fraud/enforcement/louisiana-doctor-sentenced-for-illegally-distributing-over-18m-doses-of-opioids-in-54m-health-care-fraud-scheme/
"Florida Attorney General’s Office Secures More Than $350,000 for Florida Medicaid from Pharmaceutical Company Over Kickback Allegations",2025-02-06,State Enforcement Agencies,https://oig.hhs.gov/fraud/enforcement/florida-attorney-generals-office-secures-more-than-350000-for-florida-medicaid-from-pharmaceutical-company-over-kickback-allegations/
"Pain Medical Associates Agreed to Pay $33,000 for Allegedly Violating the Civil Monetary Penalties Law by Submitting Claims for Incident-to Services Without Proper Supervision",2025-02-05,CIA Reportable Events,https://oig.hhs.gov/fraud/enforcement/pain-medical-associates-agreed-to-pay-33000-for-allegedly-violating-the-civil-monetary-penalties-law-by-submitting-claims-for-incident-to-services-without-proper-supervision/
Attorney General Bonta: Owner of Santa Cruz Residential Care Home Arrested for Elder Abuse,2025-02-05,State Enforcement Agencies,https://oig.hhs.gov/fraud/enforcement/attorney-general-bonta-owner-of-santa-cruz-residential-care-home-arrested-for-elder-abuse/
Florida Attorney General’s Office Secures More Than $2.3 Million in Multistate Action from Pfizer-Owned Biohaven Pharmaceutical Company,2025-02-05,State Enforcement Agencies,https://oig.hhs.gov/fraud/enforcement/florida-attorney-generals-office-secures-more-than-23-million-in-multistate-action-from-pfizer-owned-biohaven-pharmaceutical-company/
Attorney General James Secures Prison Sentence for Serial Health Care Fraudster,2025-02-05,State Enforcement Agencies,https://oig.hhs.gov/fraud/enforcement/attorney-general-james-secures-prison-sentence-for-serial-health-care-fraudster/
Pharmacy LLC Agrees To Resolve False Claims Act Allegations Of Billing For Drugs Not Dispensed,2025-02-04,Criminal and Civil Actions,https://oig.hhs.gov/fraud/enforcement/pharmacy-llc-agrees-to-resolve-false-claims-act-allegations-of-billing-for-drugs-not-dispensed/
Man Pleads Guilty to Conspiracy to Launder Money in Connection with $100 Million Health Care Fraud Scheme,2025-02-04,Criminal and Civil Actions,https://oig.hhs.gov/fraud/enforcement/man-pleads-guilty-to-conspiracy-to-launder-money-in-connection-with-100-million-health-care-fraud-scheme/
"Clinical Pathology Laboratories Agreed to Pay $352,000 for Allegedly Violating the Civil Monetary Penalties Law by Employing an Excluded Individual",2025-02-04,Fraud Self-Disclosures,https://oig.hhs.gov/fraud/enforcement/clinical-pathology-laboratories-agreed-to-pay-352000-for-allegedly-violating-the-civil-monetary-penalties-law-by-employing-an-excluded-individual/
AG's Office Secures Guilty Plea From Stoughton Man For Prescription Fraud And Illegal Distribution Scheme,2025-02-04,State Enforcement Agencies,https://oig.hhs.gov/fraud/enforcement/ags-office-secures-guilty-plea-from-stoughton-man-for-prescription-fraud-and-illegal-distribution-scheme/
Hartford Substance Abuse Counselor Sentenced to 27 Months in Prison for Health Care Fraud Schemes,2025-02-03,Criminal and Civil Actions,https://oig.hhs.gov/fraud/enforcement/hartford-substance-abuse-counselor-sentenced-to-27-months-in-prison-for-health-care-fraud-schemes/
Man Pleads Guilty in Connection with $17M Medicare Hospice Fraud and Home Health Care Fraud Schemes,2025-02-03,Criminal and Civil Actions,https://oig.hhs.gov/fraud/enforcement/man-pleads-guilty-in-connection-with-17m-medicare-hospice-fraud-and-home-health-care-fraud-schemes/
"Attorney General Bonta Announces Nearly $60 Million Settlement Against Pfizer-Owned Pharmaceutical Holding Company, Biohaven",2025-02-03,State Enforcement Agencies,https://oig.hhs.gov/fraud/enforcement/attorney-general-bonta-announces-nearly-60-million-settlement-against-pfizer-owned-pharmaceutical-holding-company-biohaven/
AG Campbell Secures $1.4 Million for MassHealth Over Kickback Allegations Against National Pharmaceutical Company,2025-02-03,State Enforcement Agencies,https://oig.hhs.gov/fraud/enforcement/ag-campbell-secures-14-million-for-masshealth-over-kickback-allegations-against-national-pharmaceutical-company/
AG Nessel Secures $59.7 Million Settlement Over Kickback Allegations Against Pfizer Subsidiary,2025-02-03,State Enforcement Agencies,https://oig.hhs.gov/fraud/enforcement/ag-nessel-secures-597-million-settlement-over-kickback-allegations-against-pfizer-subsidiary/
LiveCare Inc. Agrees To Pay Up To $4.9 Million To Resolve False Claims Act Allegations,2025-01-31,Criminal and Civil Actions,https://oig.hhs.gov/fraud/enforcement/livecare-inc-agrees-to-pay-up-to-49-million-to-resolve-false-claims-act-allegations/
Arizona Couple Pleads Guilty to $1.2B Health Care Fraud,2025-01-31,Criminal and Civil Actions,https://oig.hhs.gov/fraud/enforcement/arizona-couple-pleads-guilty-to-12b-health-care-fraud/
Springfield Medicaid Consultant Pleads Guilty To Stealing From Elderly Nursing Home Victims,2025-01-31,State Enforcement Agencies,https://oig.hhs.gov/fraud/enforcement/springfield-medicaid-consultant-pleads-guilty-to-stealing-from-elderly-nursing-home-victims/
"Attorney General Alan Wilson announces Anderson man charged with stealing almost $120,000 from vulnerable adult",2025-01-31,State Enforcement Agencies,https://oig.hhs.gov/fraud/enforcement/attorney-general-alan-wilson-announces-anderson-man-charged-with-stealing-almost-120000-from-vulnerable-adult/
Waterford Woman Sentenced to 2 Years in Prison for Stealing from Addiction and Mental Health Services Nonprofit,2025-01-29,Criminal and Civil Actions,https://oig.hhs.gov/fraud/enforcement/waterford-woman-sentenced-to-2-years-in-prison-for-stealing-from-addiction-and-mental-health-services-nonprofit/
Attorney General Labrador Announces Settlement in Medicaid Fraud Case,2025-01-29,State Enforcement Agencies,https://oig.hhs.gov/fraud/enforcement/attorney-general-labrador-announces-settlement-in-medicaid-fraud-case/
"Attorney General Raoul Charges Former Community-Based Home Caregiver With Abuse, Neglect Of Elderly Patient",2025-01-29,State Enforcement Agencies,https://oig.hhs.gov/fraud/enforcement/attorney-general-raoul-charges-former-community-based-home-caregiver-with-abuse-neglect-of-elderly-patient/
Woman Sentenced for Fraud Scheme Involving Claims for Unnecessary Respiratory Tests Submitted with COVID-19 Tests,2025-01-28,COVID-19,https://oig.hhs.gov/fraud/enforcement/woman-sentenced-for-fraud-scheme-involving-claims-for-unnecessary-respiratory-tests-submitted-with-covid-19-tests/
"Greensboro Laboratory and Owner Agree to Pay $850,000 to Resolve Allegations of False Claims for Urine Drug Testing",2025-01-28,Criminal and Civil Actions,https://oig.hhs.gov/fraud/enforcement/greensboro-laboratory-and-owner-agree-to-pay-850000-to-resolve-allegations-of-false-claims-for-urine-drug-testing/
"Philadelphia Mental Health Clinic and Its Psychiatrist Owner Agree to Pay $900,000 to Resolve False Claims Act Lawsuit for Alleged Medicaid Fraud",2025-01-27,Criminal and Civil Actions,https://oig.hhs.gov/fraud/enforcement/philadelphia-mental-health-clinic-and-its-psychiatrist-owner-agree-to-pay-900000-to-resolve-false-claims-act-lawsuit-for-alleged-medicaid-fraud/
Greenfield Man Sentenced to 15 Months’ Imprisonment for Paying Healthcare Kickbacks,2025-01-27,Criminal and Civil Actions,https://oig.hhs.gov/fraud/enforcement/greenfield-man-sentenced-to-15-months-imprisonment-for-paying-healthcare-kickbacks/
Florida Attorney General’s Office’s Medicaid Fraud Control Unit Secures More Than $2.2 Million for Florida Medicaid from Inpatient Behavioral Health Company,2025-01-27,State Enforcement Agencies,https://oig.hhs.gov/fraud/enforcement/florida-attorney-generals-offices-medicaid-fraud-control-unit-secures-more-than-22-million-for-florida-medicaid-from-inpatient-behavioral-health-company/
Madison Man Sentenced to 37 Months in Prison for Conspiracy to Defraud the United States,2025-01-24,Criminal and Civil Actions,https://oig.hhs.gov/fraud/enforcement/madison-man-sentenced-to-37-months-in-prison-for-conspiracy-to-defraud-the-united-states/
Corporation and Former Chief Executive Officer Plead Guilty to Health Care Fraud and Tax Conspiracy,2025-01-24,Criminal and Civil Actions,https://oig.hhs.gov/fraud/enforcement/corporation-and-former-chief-executive-officer-plead-guilty-to-health-care-fraud-and-tax-conspiracy/
Pfizer Agrees to Pay Nearly 60M to Resolve False Claims Allegations Relating to Improper Physician Payments by Subsidiary,2025-01-24,Criminal and Civil Actions,https://oig.hhs.gov/fraud/enforcement/pfizer-agrees-to-pay-nearly-60m-to-resolve-false-claims-allegations-relating-to-improper-physician-payments-by-subsidiary/
"Wellstar Health System Agreed to Pay $468,000 for Allegedly Violating the Civil Monetary Penalties Law by Submitting Claims for Services Provided by an Unlicensed Individual",2025-01-24,Fraud Self-Disclosures,https://oig.hhs.gov/fraud/enforcement/wellstar-health-system-agreed-to-pay-468000-for-allegedly-violating-the-civil-monetary-penalties-law-by-submitting-claims-for-services-provided-by-an-unlicensed-individual/
"Walnut Creek Nursing Center Agreed to Pay $243,000 for Allegedly Violating the Civil Monetary Penalties Law by Employing an Excluded Individual",2025-01-23,CMP and Affirmative Exclusions,https://oig.hhs.gov/fraud/enforcement/walnut-creek-nursing-center-agreed-to-pay-243000-for-allegedly-violating-the-civil-monetary-penalties-law-by-employing-an-excluded-individual/
Operator of Home Health Care Company Sentenced to 12 Years in Prison for Multimillion Dollar Health Care Fraud Scheme,2025-01-23,Criminal and Civil Actions,https://oig.hhs.gov/fraud/enforcement/operator-of-home-health-care-company-sentenced-to-12-years-in-prison-for-multimillion-dollar-health-care-fraud-scheme/
