title,date,category,link
Houston Transplant Doctor Indicted For Making False Statements In Patients’ Medical Records,2026-02-05,Criminal and Civil Actions,https://oig.hhs.gov/fraud/enforcement/houston-transplant-doctor-indicted-for-making-false-statements-in-patients-medical-records/
MultiCare Health System to Pay Millions to Settle Fraud Case,2026-02-04,Criminal and Civil Actions,https://oig.hhs.gov/fraud/enforcement/multicare-health-system-to-pay-millions-to-settle-fraud-case/
Brooklyn Banker Pleads Guilty to Laundering Proceeds of Medicare Fraud for Transnational Criminal Organization,2026-02-03,COVID-19,https://oig.hhs.gov/fraud/enforcement/brooklyn-banker-pleads-guilty-to-laundering-proceeds-of-medicare-fraud-for-transnational-criminal-organization/
Delafield Man Sentenced to 18 Months’ Imprisonment for Conspiracy to Pay Health Care Kickbacks,2026-02-03,Criminal and Civil Actions,https://oig.hhs.gov/fraud/enforcement/delafield-man-sentenced-to-18-months-imprisonment-for-conspiracy-to-pay-health-care-kickbacks/
Former NFL Player Convicted for $197M Medicare Fraud,2026-02-03,Criminal and Civil Actions,https://oig.hhs.gov/fraud/enforcement/former-nfl-player-convicted-for-197m-medicare-fraud/
Attorney General Hanaway Obtains Medicaid Fraud Conviction Against Couple Lying About Marital Status To Steal Funds,2026-02-03,State Enforcement Agencies,https://oig.hhs.gov/fraud/enforcement/attorney-general-hanaway-obtains-medicaid-fraud-conviction-against-couple-lying-about-marital-status-to-steal-funds/
"AG's Office Secures Indictments Against Peabody Alcohol and Drug Counselor and Her Businesses for More Than $850,000 in MassHealth Fraud",2026-02-02,State Enforcement Agencies,https://oig.hhs.gov/fraud/enforcement/ags-office-secures-indictments-against-peabody-alcohol-and-drug-counselor-and-her-businesses-for-more-than-850000-in-masshealth-fraud/
Florida Man Pleads Guilty to Conspiracy to Violate the Anti-Kickback Statute,2026-01-30,Criminal and Civil Actions,https://oig.hhs.gov/fraud/enforcement/florida-man-pleads-guilty-to-conspiracy-to-violate-the-anti-kickback-statute/
Forefront Living Hospice Agreed to Pay $1.9 Million for Allegedly Violating the Civil Monetary Penalties Law by Submitting Claims for Services that Identified the Incorrect Provider or Were Performed by Non-enrolled or Incorrect Providers,2026-01-30,Fraud Self-Disclosures,https://oig.hhs.gov/fraud/enforcement/forefront-living-hospice-agreed-to-pay-19-million-for-allegedly-violating-the-civil-monetary-penalties-law-by-submitting-claims-for-services-that-identified-the-incorrect-provider-or-were-performed-by-non-enrolled-or-incorrect-providers/
Attorney General Jeff Jackson Announces Health Care Fraud Conviction and Settlement,2026-01-30,State Enforcement Agencies,https://oig.hhs.gov/fraud/enforcement/attorney-general-jeff-jackson-announces-health-care-fraud-conviction-and-settlement/
Yadkinville Woman Sentenced in Connection with Multi-Million Dollar Medicaid Fraud Scheme,2026-01-29,Criminal and Civil Actions,https://oig.hhs.gov/fraud/enforcement/yadkinville-woman-sentenced-in-connection-with-multi-million-dollar-medicaid-fraud-scheme/
Attorney General Labrador Announces Sentencing of Kootenai County Woman for Public Assistance Provider Fraud,2026-01-29,State Enforcement Agencies,https://oig.hhs.gov/fraud/enforcement/attorney-general-labrador-announces-sentencing-of-kootenai-county-woman-for-public-assistance-provider-fraud/
Attorney General Hanaway Obtains Medicaid Fraud Conviction For Services Not Provided,2026-01-29,State Enforcement Agencies,https://oig.hhs.gov/fraud/enforcement/attorney-general-hanaway-obtains-medicaid-fraud-conviction-for-services-not-provided/
"Holmes Regional Medical Center Agreed to Pay $113,000 for Allegedly Violating Patient Dumping Statute by Failing to Provide an Appropriate Medical Screening Examination",2026-01-28,CMP and Affirmative Exclusions,https://oig.hhs.gov/fraud/enforcement/holmes-regional-medical-center-agreed-to-pay-113000-for-allegedly-violating-patient-dumping-statute-by-failing-to-provide-an-appropriate-medical-screening-examination/
Slidell Chiropractor Sentenced for Health Care Fraud,2026-01-28,COVID-19,https://oig.hhs.gov/fraud/enforcement/slidell-chiropractor-sentenced-for-health-care-fraud/
Repeat Health Care Fraud Offender Sentenced for Defrauding New Hampshire Medicaid,2026-01-28,Criminal and Civil Actions,https://oig.hhs.gov/fraud/enforcement/repeat-health-care-fraud-offender-sentenced-for-defrauding-new-hampshire-medicaid/
"Scranton Heart Institute Agrees To Pay $48,709.20 To Settle False Claims Act Allegations",2026-01-28,Criminal and Civil Actions,https://oig.hhs.gov/fraud/enforcement/scranton-heart-institute-agrees-to-pay-4870920-to-settle-false-claims-act-allegations/
Rheumatologist Agrees To Resolve False Claims Act Allegations Related To Unapproved Drugs,2026-01-28,Criminal and Civil Actions,https://oig.hhs.gov/fraud/enforcement/rheumatologist-agrees-to-resolve-false-claims-act-allegations-related-to-unapproved-drugs/
Attorney General James Uthmeier Announces Arrests in Central Florida Medicaid Fraud Scheme,2026-01-28,State Enforcement Agencies,https://oig.hhs.gov/fraud/enforcement/attorney-general-james-uthmeier-announces-arrests-in-central-florida-medicaid-fraud-scheme/
"Cordell Memorial Hospital Agreed to Pay $40,000 for Allegedly Violating Patient Dumping Statute by Failing to Provide an Appropriate Medical Screening Examination",2026-01-27,CMP and Affirmative Exclusions,https://oig.hhs.gov/fraud/enforcement/cordell-memorial-hospital-agreed-to-pay-40000-for-allegedly-violating-patient-dumping-statute-by-failing-to-provide-an-appropriate-medical-screening-examination/
Houston Transplant Doctor Indicted For Making False Statements In Patients’ Medical Records,2026-02-05,Criminal and Civil Actions,https://oig.hhs.gov/fraud/enforcement/houston-transplant-doctor-indicted-for-making-false-statements-in-patients-medical-records/
MultiCare Health System to Pay Millions to Settle Fraud Case,2026-02-04,Criminal and Civil Actions,https://oig.hhs.gov/fraud/enforcement/multicare-health-system-to-pay-millions-to-settle-fraud-case/
Brooklyn Banker Pleads Guilty to Laundering Proceeds of Medicare Fraud for Transnational Criminal Organization,2026-02-03,COVID-19,https://oig.hhs.gov/fraud/enforcement/brooklyn-banker-pleads-guilty-to-laundering-proceeds-of-medicare-fraud-for-transnational-criminal-organization/
Delafield Man Sentenced to 18 Months’ Imprisonment for Conspiracy to Pay Health Care Kickbacks,2026-02-03,Criminal and Civil Actions,https://oig.hhs.gov/fraud/enforcement/delafield-man-sentenced-to-18-months-imprisonment-for-conspiracy-to-pay-health-care-kickbacks/
Former NFL Player Convicted for $197M Medicare Fraud,2026-02-03,Criminal and Civil Actions,https://oig.hhs.gov/fraud/enforcement/former-nfl-player-convicted-for-197m-medicare-fraud/
Attorney General Hanaway Obtains Medicaid Fraud Conviction Against Couple Lying About Marital Status To Steal Funds,2026-02-03,State Enforcement Agencies,https://oig.hhs.gov/fraud/enforcement/attorney-general-hanaway-obtains-medicaid-fraud-conviction-against-couple-lying-about-marital-status-to-steal-funds/
"AG's Office Secures Indictments Against Peabody Alcohol and Drug Counselor and Her Businesses for More Than $850,000 in MassHealth Fraud",2026-02-02,State Enforcement Agencies,https://oig.hhs.gov/fraud/enforcement/ags-office-secures-indictments-against-peabody-alcohol-and-drug-counselor-and-her-businesses-for-more-than-850000-in-masshealth-fraud/
Florida Man Pleads Guilty to Conspiracy to Violate the Anti-Kickback Statute,2026-01-30,Criminal and Civil Actions,https://oig.hhs.gov/fraud/enforcement/florida-man-pleads-guilty-to-conspiracy-to-violate-the-anti-kickback-statute/
Forefront Living Hospice Agreed to Pay $1.9 Million for Allegedly Violating the Civil Monetary Penalties Law by Submitting Claims for Services that Identified the Incorrect Provider or Were Performed by Non-enrolled or Incorrect Providers,2026-01-30,Fraud Self-Disclosures,https://oig.hhs.gov/fraud/enforcement/forefront-living-hospice-agreed-to-pay-19-million-for-allegedly-violating-the-civil-monetary-penalties-law-by-submitting-claims-for-services-that-identified-the-incorrect-provider-or-were-performed-by-non-enrolled-or-incorrect-providers/
Attorney General Jeff Jackson Announces Health Care Fraud Conviction and Settlement,2026-01-30,State Enforcement Agencies,https://oig.hhs.gov/fraud/enforcement/attorney-general-jeff-jackson-announces-health-care-fraud-conviction-and-settlement/
Yadkinville Woman Sentenced in Connection with Multi-Million Dollar Medicaid Fraud Scheme,2026-01-29,Criminal and Civil Actions,https://oig.hhs.gov/fraud/enforcement/yadkinville-woman-sentenced-in-connection-with-multi-million-dollar-medicaid-fraud-scheme/
Attorney General Labrador Announces Sentencing of Kootenai County Woman for Public Assistance Provider Fraud,2026-01-29,State Enforcement Agencies,https://oig.hhs.gov/fraud/enforcement/attorney-general-labrador-announces-sentencing-of-kootenai-county-woman-for-public-assistance-provider-fraud/
Attorney General Hanaway Obtains Medicaid Fraud Conviction For Services Not Provided,2026-01-29,State Enforcement Agencies,https://oig.hhs.gov/fraud/enforcement/attorney-general-hanaway-obtains-medicaid-fraud-conviction-for-services-not-provided/
"Holmes Regional Medical Center Agreed to Pay $113,000 for Allegedly Violating Patient Dumping Statute by Failing to Provide an Appropriate Medical Screening Examination",2026-01-28,CMP and Affirmative Exclusions,https://oig.hhs.gov/fraud/enforcement/holmes-regional-medical-center-agreed-to-pay-113000-for-allegedly-violating-patient-dumping-statute-by-failing-to-provide-an-appropriate-medical-screening-examination/
Slidell Chiropractor Sentenced for Health Care Fraud,2026-01-28,COVID-19,https://oig.hhs.gov/fraud/enforcement/slidell-chiropractor-sentenced-for-health-care-fraud/
Repeat Health Care Fraud Offender Sentenced for Defrauding New Hampshire Medicaid,2026-01-28,Criminal and Civil Actions,https://oig.hhs.gov/fraud/enforcement/repeat-health-care-fraud-offender-sentenced-for-defrauding-new-hampshire-medicaid/
"Scranton Heart Institute Agrees To Pay $48,709.20 To Settle False Claims Act Allegations",2026-01-28,Criminal and Civil Actions,https://oig.hhs.gov/fraud/enforcement/scranton-heart-institute-agrees-to-pay-4870920-to-settle-false-claims-act-allegations/
Rheumatologist Agrees To Resolve False Claims Act Allegations Related To Unapproved Drugs,2026-01-28,Criminal and Civil Actions,https://oig.hhs.gov/fraud/enforcement/rheumatologist-agrees-to-resolve-false-claims-act-allegations-related-to-unapproved-drugs/
Attorney General James Uthmeier Announces Arrests in Central Florida Medicaid Fraud Scheme,2026-01-28,State Enforcement Agencies,https://oig.hhs.gov/fraud/enforcement/attorney-general-james-uthmeier-announces-arrests-in-central-florida-medicaid-fraud-scheme/
"Cordell Memorial Hospital Agreed to Pay $40,000 for Allegedly Violating Patient Dumping Statute by Failing to Provide an Appropriate Medical Screening Examination",2026-01-27,CMP and Affirmative Exclusions,https://oig.hhs.gov/fraud/enforcement/cordell-memorial-hospital-agreed-to-pay-40000-for-allegedly-violating-patient-dumping-statute-by-failing-to-provide-an-appropriate-medical-screening-examination/
Syracuse Area Man Pleads Guilty to Operating Kickback Scheme Involving Medicare and Medicaid,2026-01-27,Criminal and Civil Actions,https://oig.hhs.gov/fraud/enforcement/syracuse-area-man-pleads-guilty-to-operating-kickback-scheme-involving-medicare-and-medicaid/
Attorney General Jeff Jackson Announces $8.8 Million Health Care Fraud Settlement,2026-01-27,State Enforcement Agencies,https://oig.hhs.gov/fraud/enforcement/attorney-general-jeff-jackson-announces-88-million-health-care-fraud-settlement/
Attorney General Alan Wilson Announces Nurse Aide Charged With Assaulting Assisted Living Patient,2026-01-27,State Enforcement Agencies,https://oig.hhs.gov/fraud/enforcement/attorney-general-alan-wilson-announces-nurse-aide-charged-with-assaulting-assisted-living-patient/
"Two Home Health Providers Agree to Pay $702,541 to Resolve Self-Referral Allegations",2026-01-26,Criminal and Civil Actions,https://oig.hhs.gov/fraud/enforcement/two-home-health-providers-agree-to-pay-702541-to-resolve-self-referral-allegations/
Florida Laboratory Owner Pleads Guilty to $52M Medicare Fraud Scheme Involving Genetic Tests,2026-01-26,Criminal and Civil Actions,https://oig.hhs.gov/fraud/enforcement/florida-laboratory-owner-pleads-guilty-to-52m-medicare-fraud-scheme-involving-genetic-tests/
"Brickyard Healthcare - Willow Springs Care Center Agreed to Pay $99,000 for Allegedly Violating the Civil Monetary Penalties Law by Submitting Claims for Services Provided by an Unlicensed Individual",2026-01-26,Fraud Self-Disclosures,https://oig.hhs.gov/fraud/enforcement/brickyard-healthcare-willow-springs-care-center-agreed-to-pay-99000-for-allegedly-violating-the-civil-monetary-penalties-law-by-submitting-claims-for-services-provided-by-an-unlicensed-individual/
"National Providers in Healthcare and Medstream Anesthesia Hawaii Agreed to Pay $254,000 for Allegedly Violating the Civil Monetary Penalties Law by Submitting Claims for Services that Failed to Meet Coverage Criteria",2026-01-26,Fraud Self-Disclosures,https://oig.hhs.gov/fraud/enforcement/national-providers-in-healthcare-and-medstream-anesthesia-hawaii-agreed-to-pay-254000-for-allegedly-violating-the-civil-monetary-penalties-law-by-submitting-claims-for-services-that-failed-to-meet-coverage-criteria/
Two Women Charged with Health Care Fraud for Allegedly Illegally Providing Medical Services,2026-01-26,State Enforcement Agencies,https://oig.hhs.gov/fraud/enforcement/two-women-charged-with-health-care-fraud-for-allegedly-illegally-providing-medical-services/
TennCare Fraud Investigation Leads to Arrests of Three Former Memphis Caregivers,2026-01-26,State Enforcement Agencies,https://oig.hhs.gov/fraud/enforcement/tenncare-fraud-investigation-leads-to-arrests-of-three-former-memphis-caregivers/
Georgia Chiropractor Convicted Of Health Care Fraud,2026-01-23,COVID-19,https://oig.hhs.gov/fraud/enforcement/georgia-chiropractor-convicted-of-health-care-fraud/
Cheshire Nurse Admits Illegally Distributing Controlled Substances,2026-01-23,Criminal and Civil Actions,https://oig.hhs.gov/fraud/enforcement/cheshire-nurse-admits-illegally-distributing-controlled-substances/
Attorney General Hanaway Secures Medicaid Fraud Conviction in St. Louis,2026-01-23,State Enforcement Agencies,https://oig.hhs.gov/fraud/enforcement/attorney-general-hanaway-secures-medicaid-fraud-conviction-in-st-louis/
"Memphis Woman Sentenced to 41 Months in Federal Prison for Defrauding COVID-19 Relief Programs of Over $560,000",2026-01-22,COVID-19,https://oig.hhs.gov/fraud/enforcement/memphis-woman-sentenced-to-41-months-in-federal-prison-for-defrauding-covid-19-relief-programs-of-over-560000/
"Chipley-Based Physical Therapy Practice Pays Over $750,000 To Resolve False Claims Act Litigation",2026-01-22,Criminal and Civil Actions,https://oig.hhs.gov/fraud/enforcement/chipley-based-physical-therapy-practice-pays-over-750000-to-resolve-false-claims-act-litigation/
Florida Nursing Assistant Convicted in $11.4M Health Care Fraud Scheme Targeting Medicare Beneficiaries,2026-01-22,Criminal and Civil Actions,https://oig.hhs.gov/fraud/enforcement/florida-nursing-assistant-convicted-in-114m-health-care-fraud-scheme-targeting-medicare-beneficiaries/
Traditions Health Agrees to Pay $34M to Resolve False Claims Act Liability Relating to Home Health Services Following Self Disclosure,2026-01-22,Criminal and Civil Actions,https://oig.hhs.gov/fraud/enforcement/traditions-health-agrees-to-pay-34m-to-resolve-false-claims-act-liability-relating-to-home-health-services-following-self-disclosure/
Former Saginaw Physician to Stand Trial on 23 Counts of Medicaid Fraud,2026-01-22,State Enforcement Agencies,https://oig.hhs.gov/fraud/enforcement/former-saginaw-physician-to-stand-trial-on-23-counts-of-medicaid-fraud/
"Former Zynex, Inc. Executives Charged with Health Care and Securities Fraud and Related Offenses",2026-01-21,Criminal and Civil Actions,https://oig.hhs.gov/fraud/enforcement/former-zynex-inc-executives-charged-with-health-care-and-securities-fraud-and-related-offenses/
Justice Department Files False Claims Act Complaint Against Priority Hospital Group and Three Long Term Care Hospitals,2026-01-21,Criminal and Civil Actions,https://oig.hhs.gov/fraud/enforcement/justice-department-files-false-claims-act-complaint-against-priority-hospital-group-and-three-long-term-care-hospitals/
Four Hudson County Pharmacies Pay $4.3 Million To Resolve False Claims Act Allegations of Billing for Drugs Not Dispensed,2026-01-20,Criminal and Civil Actions,https://oig.hhs.gov/fraud/enforcement/four-hudson-county-pharmacies-pay-43-million-to-resolve-false-claims-act-allegations-of-billing-for-drugs-not-dispensed/
Health Care Executive Pleads Guilty to Kickback Scheme in Vermont,2026-01-20,Criminal and Civil Actions,https://oig.hhs.gov/fraud/enforcement/health-care-executive-pleads-guilty-to-kickback-scheme-in-vermont/
"Lake Minnetonka Shores Agreed to Pay $113,000 for Allegedly Violating the Civil Monetary Penalties Law by Submitting Claims for Services Provided by an Unlicensed Individual",2026-01-20,Fraud Self-Disclosures,https://oig.hhs.gov/fraud/enforcement/lake-minnetonka-shores-agreed-to-pay-113000-for-allegedly-violating-the-civil-monetary-penalties-law-by-submitting-claims-for-services-provided-by-an-unlicensed-individual/
Attorney General Nessel Charges Former CEO of Oxford Recovery Center with Nine Counts of Health Care Fraud – False Claims,2026-01-20,State Enforcement Agencies,https://oig.hhs.gov/fraud/enforcement/attorney-general-nessel-charges-former-ceo-of-oxford-recovery-center-with-nine-counts-of-health-care-fraud-false-claims/
Defense Contractor President Sentenced to 48 Months in Bribery Scheme,2026-01-16,Criminal and Civil Actions,https://oig.hhs.gov/fraud/enforcement/defense-contractor-president-sentenced-to-48-months-in-bribery-scheme/
AG Murrill's Medicaid Fraud Control Unit Secures Guilty Plea For Alexandria Man For Dragging A Victim Across A Hallway By His Wrist,2026-01-16,State Enforcement Agencies,https://oig.hhs.gov/fraud/enforcement/ag-murrills-medicaid-fraud-control-unit-secures-guilty-plea-for-alexandria-man-for-dragging-a-victim-across-a-hallway-by-his-wrist/
Five Ophthalmology Practices Agree to Pay Nearly $6M to Resolve Allegations of Fraudulent Claims to Medicare and Medicaid for Cranial Ultrasounds,2026-01-15,Criminal and Civil Actions,https://oig.hhs.gov/fraud/enforcement/five-ophthalmology-practices-agree-to-pay-nearly-6m-to-resolve-allegations-of-fraudulent-claims-to-medicare-and-medicaid-for-cranial-ultrasounds/
Honduran Man and Kansas Woman Indicted for Fraudulently Obtaining Custody of an Unaccompanied Alien Child,2026-01-15,Criminal and Civil Actions,https://oig.hhs.gov/fraud/enforcement/honduran-man-and-kansas-woman-indicted-for-fraudulently-obtaining-custody-of-an-unaccompanied-alien-child/
Two Individuals Plead Guilty to $68 Million Adult Day Care Fraud Scheme,2026-01-15,Criminal and Civil Actions,https://oig.hhs.gov/fraud/enforcement/two-individuals-plead-guilty-to-68-million-adult-day-care-fraud-scheme/
Eye Care Clinics Agree To Pay Combined $520K Over Illegal Medicaid Billing,2026-01-15,State Enforcement Agencies,https://oig.hhs.gov/fraud/enforcement/eye-care-clinics-agree-to-pay-combined-520k-over-illegal-medicaid-billing/
Attorney General Jeff Jackson Announces $15.6 Million Health Care Conviction,2026-01-15,State Enforcement Agencies,https://oig.hhs.gov/fraud/enforcement/attorney-general-jeff-jackson-announces-156-million-health-care-conviction/
"Former Memphis Caregiver Arrested, Charged with Abuse of Vulnerable Adult",2026-01-15,State Enforcement Agencies,https://oig.hhs.gov/fraud/enforcement/former-memphis-caregiver-arrested-charged-with-abuse-of-vulnerable-adult/
Kinston Woman Sentenced To 6 Years In Federal Prison And Ordered To Repay Over $15 Million In Restitution For Health Care Fraud,2026-01-14,Criminal and Civil Actions,https://oig.hhs.gov/fraud/enforcement/kinston-woman-sentenced-to-6-years-in-federal-prison-and-ordered-to-repay-over-15-million-in-restitution-for-health-care-fraud/
Ohio Doctor Sentenced to Prison for $14 Million Health Care Fraud Scheme,2026-01-14,Criminal and Civil Actions,https://oig.hhs.gov/fraud/enforcement/ohio-doctor-sentenced-to-prison-for-14-million-health-care-fraud-scheme/
Kaiser Permanente Affiliates Pay $556 Million to Resolve False Claims Act Allegations,2026-01-14,Criminal and Civil Actions,https://oig.hhs.gov/fraud/enforcement/kaiser-permanente-affiliates-pay-556-million-to-resolve-false-claims-act-allegations/
Attorney General Ellison Announces Over $3 Million In Fraud Charges Against Medicaid Provider,2026-01-14,State Enforcement Agencies,https://oig.hhs.gov/fraud/enforcement/attorney-general-ellison-announces-over-3-million-in-fraud-charges-against-medicaid-provider/
Attorney General James Announces Conviction and Sentencing of Suffolk County Transportation Company Owner for Stealing Over $1 Million from Medicaid,2026-01-14,State Enforcement Agencies,https://oig.hhs.gov/fraud/enforcement/attorney-general-james-announces-conviction-and-sentencing-of-suffolk-county-transportation-company-owner-for-stealing-over-1-million-from-medicaid/
"Attorney General Alan Wilson Announces Chesnee Man Charged With Stealing More Than $17,000 From Assisted Living Resident",2026-01-14,State Enforcement Agencies,https://oig.hhs.gov/fraud/enforcement/attorney-general-alan-wilson-announces-chesnee-man-charged-with-stealing-more-than-17000-from-assisted-living-resident/
Attorney General Alan Wilson Announces Former Assisted Living Facility Employee Charged With Stealing From Resident,2026-01-14,State Enforcement Agencies,https://oig.hhs.gov/fraud/enforcement/attorney-general-alan-wilson-announces-former-assisted-living-facility-employee-charged-with-stealing-from-resident/
Attor­ney Gen­er­al Ken Pax­ton Arrests Over 120 Peo­ple and Col­lects Over $125 Mil­lion from Health­care Fraud­sters in 2025 Alone,2026-01-14,State Enforcement Agencies,https://oig.hhs.gov/fraud/enforcement/attorney-general-ken-paxton-arrests-over-120-people-and-collects-over-125-million-from-healthcare-fraudsters-in-2025-alone/
Prison Time For Healthcare Employees In Multimillion Dollar Adult Daycare Fraud Scheme,2026-01-13,Criminal and Civil Actions,https://oig.hhs.gov/fraud/enforcement/prison-time-for-healthcare-employees-in-multimillion-dollar-adult-daycare-fraud-scheme/
Prison Time For Health Care Employees In Multimillion Dollar Adult Daycare Fraud Scheme,2026-01-13,Criminal and Civil Actions,https://oig.hhs.gov/fraud/enforcement/prison-time-for-health-care-employees-in-multimillion-dollar-adult-daycare-fraud-scheme/
Atlantic Biologicals Corporation Enters into Deferred Prosecution Agreement in Opioid Distribution Scheme,2026-01-13,Criminal and Civil Actions,https://oig.hhs.gov/fraud/enforcement/atlantic-biologicals-corporation-enters-into-deferred-prosecution-agreement-in-opioid-distribution-scheme/
Carr: Warner Robins Woman Convicted of Defrauding Georgia Medicaid of $5.4 Million,2026-01-13,State Enforcement Agencies,https://oig.hhs.gov/fraud/enforcement/carr-warner-robins-woman-convicted-of-defrauding-georgia-medicaid-of-54-million/
AG Sunday’s Medicaid Fraud Control Section Secures Prison Sentence for Office Manager in Montgomery County-Based Company’s $1.76 Million Fraud Scheme,2026-01-13,State Enforcement Agencies,https://oig.hhs.gov/fraud/enforcement/ag-sundays-medicaid-fraud-control-section-secures-prison-sentence-for-office-manager-in-montgomery-county-based-companys-176-million-fraud-scheme/
Non-Profit Executive Convicted of Theft of Federal Funds,2026-01-12,Criminal and Civil Actions,https://oig.hhs.gov/fraud/enforcement/non-profit-executive-convicted-of-theft-of-federal-funds/
"DOJ and Seattle-based FidaLab, LLC settle allegations it inflated bills to government health care programs",2026-01-12,Criminal and Civil Actions,https://oig.hhs.gov/fraud/enforcement/doj-and-seattle-based-fidalab-llc-settle-allegations-it-inflated-bills-to-government-health-care-programs/
The Health Care Authority for Baptist Health Agreed to Pay $1.4 Million for Allegedly Violating the Civil Monetary Penalties Law by Submitting Claims for Upcoding Inpatient Hospital Services,2026-01-12,Fraud Self-Disclosures,https://oig.hhs.gov/fraud/enforcement/the-health-care-authority-for-baptist-health-agreed-to-pay-14-million-for-allegedly-violating-the-civil-monetary-penalties-law-by-submitting-claims-for-upcoding-inpatient-hospital-services/
Attorney General Announces Home Care Aide Charged With Sexually Assaulting Minor And Vulnerable Adult,2026-01-12,State Enforcement Agencies,https://oig.hhs.gov/fraud/enforcement/attorney-general-announces-home-care-aide-charged-with-sexually-assaulting-minor-and-vulnerable-adult/
Portland Woman Pleads Guilty to Abusive Sexual Contact,2026-01-09,Criminal and Civil Actions,https://oig.hhs.gov/fraud/enforcement/portland-woman-pleads-guilty-to-abusive-sexual-contact/
"Pain Clinic Owner Sentenced, L5 Medical Holdings to Pay Nearly $5 Million in Restitution",2026-01-09,Criminal and Civil Actions,https://oig.hhs.gov/fraud/enforcement/pain-clinic-owner-sentenced-l5-medical-holdings-to-pay-nearly-5-million-in-restitution/
"Avantara North Agreed to Pay $20,000 for Allegedly Violating the Civil Monetary Penalties Law by Submitting Claims for Services Provided by an Unlicensed Individual",2026-01-09,Fraud Self-Disclosures,https://oig.hhs.gov/fraud/enforcement/avantara-north-agreed-to-pay-20000-for-allegedly-violating-the-civil-monetary-penalties-law-by-submitting-claims-for-services-provided-by-an-unlicensed-individual/
