title,date,category,link
Illinois Man Charged in Durable Medical Equipment Scheme,2025-08-07,Criminal and Civil Actions,https://oig.hhs.gov/fraud/enforcement/illinois-man-charged-in-durable-medical-equipment-scheme/
"Elite Medical Transport Agreed to Pay $144,000 for Allegedly Violating the Civil Monetary Penalties Law by Submitting Claims for Services Containing Forged and Invalid Signatures",2025-08-07,Fraud Self-Disclosures,https://oig.hhs.gov/fraud/enforcement/elite-medical-transport-agreed-to-pay-144000-for-allegedly-violating-the-civil-monetary-penalties-law-by-submitting-claims-for-services-containing-forged-and-invalid-signatures/
Jorden Borders sentenced to 468 months in prison,2025-08-07,State Enforcement Agencies,https://oig.hhs.gov/fraud/enforcement/jorden-borders-sentenced-to-468-months-in-prison/
Would-be smuggler of three-year-old child sentenced to 36 months in federal prison,2025-08-06,Criminal and Civil Actions,https://oig.hhs.gov/fraud/enforcement/would-be-smuggler-of-three-year-old-child-sentenced-to-36-months-in-federal-prison/
APRN and Medical Practice to Pay Over $600k and Cease Connecticut Medicaid Participation to Settle False Claims Act Allegations,2025-08-06,Criminal and Civil Actions,https://oig.hhs.gov/fraud/enforcement/aprn-and-medical-practice-to-pay-over-600k-and-cease-connecticut-medicaid-participation-to-settle-false-claims-act-allegations/
Justice Department Files Two Civil Forfeiture Actions to Recover Nearly $11 Million in Health Care Fraud Proceeds,2025-08-06,Criminal and Civil Actions,https://oig.hhs.gov/fraud/enforcement/justice-department-files-two-civil-forfeiture-actions-to-recover-nearly-11-million-in-health-care-fraud-proceeds/
Leader of $68M Adult Day Care Fraud Scheme Pleads Guilty,2025-08-06,Criminal and Civil Actions,https://oig.hhs.gov/fraud/enforcement/leader-of-68m-adult-day-care-fraud-scheme-pleads-guilty/
"University Physicians of Brooklyn Agreed to Pay $455,000 for Allegedly Violating the Civil Monetary Penalties Law by Submitting Claims for Incident-to Services Not Covered",2025-08-06,Fraud Self-Disclosures,https://oig.hhs.gov/fraud/enforcement/university-physicians-of-brooklyn-agreed-to-pay-455000-for-allegedly-violating-the-civil-monetary-penalties-law-by-submitting-claims-for-incident-to-services-not-covered/
"Woodland Springs Agreed to Pay $188,000 for Allegedly Violating the Civil Monetary Penalties Law by Submitting Claims for Services Provided by Unlicensed Individuals",2025-08-06,Fraud Self-Disclosures,https://oig.hhs.gov/fraud/enforcement/woodland-springs-agreed-to-pay-188000-for-allegedly-violating-the-civil-monetary-penalties-law-by-submitting-claims-for-services-provided-by-unlicensed-individuals/
Attorney General Tong Announces APRN and Medical Practice to Pay Over $600k And Cease Connecticut Medicaid Participation to Settle False Claims Act Allegations,2025-08-06,State Enforcement Agencies,https://oig.hhs.gov/fraud/enforcement/attorney-general-tong-announces-aprn-and-medical-practice-to-pay-over-600k-and-cease-connecticut-medicaid-participation-to-settle-false-claims-act-allegations/
Glendale Woman Sentenced to 9 Years in Federal Prison for $10.6 Million Hospice Fraud Scheme Involving Kickbacks for Patients,2025-08-05,Criminal and Civil Actions,https://oig.hhs.gov/fraud/enforcement/glendale-woman-sentenced-to-9-years-in-federal-prison-for-106-million-hospice-fraud-scheme-involving-kickbacks-for-patients/
Canton Man Pleads Guilty to Multi-Million-Dollar Health Care Fraud Scheme,2025-08-05,Criminal and Civil Actions,https://oig.hhs.gov/fraud/enforcement/canton-man-pleads-guilty-to-multi-million-dollar-health-care-fraud-scheme/
"AG's Office Secures Indictments Against Northampton Resident for Causing More Than $99,000 in False Claims to MassHealth",2025-08-05,State Enforcement Agencies,https://oig.hhs.gov/fraud/enforcement/ags-office-secures-indictments-against-northampton-resident-for-causing-more-than-99000-in-false-claims-to-masshealth/
"Zavier Ash, MD Agreed to Pay $209,000 for Allegedly Violating the Civil Monetary Penalties Law by Receiving Remuneration in Exchange for Prescribing Medications",2025-08-04,CMP and Affirmative Exclusions,https://oig.hhs.gov/fraud/enforcement/zavier-ash-md-agreed-to-pay-209000-for-allegedly-violating-the-civil-monetary-penalties-law-by-receiving-remuneration-in-exchange-for-prescribing/
"St. Luke's Hospital of Duluth Agreed to Pay $214,000 for Allegedly Violating the Civil Monetary Penalties Law by Paying Remuneration in the Form of Free Technology Services",2025-08-04,Fraud Self-Disclosures,https://oig.hhs.gov/fraud/enforcement/st-luke%C3%A6s-hospital-of-duluth-agreed-to-pay-214000-for-allegedly-violating-the-civil-monetary-penalties-law-by-paying-remuneration-in-the-form-of-free-technology-services/
AG Campbell Secures $6 Million Settlement With Weymouth-Based Ambulance Companies For MassHealth False Claims,2025-08-04,State Enforcement Agencies,https://oig.hhs.gov/fraud/enforcement/ag-campbell-secures-6-million-settlement-with-weymouth-based-ambulance-companies-for-masshealth-false-claims/
"The Pointe Outpatient Behavioral Health Services Agreed to Pay $74,000 for Allegedly Violating the Civil Monetary Penalties Law by Employing an Excluded Individual",2025-07-31,CIA Reportable Events,https://oig.hhs.gov/fraud/enforcement/the-pointe-outpatient-behavioral-health-services-agreed-to-pay-74000-for-allegedly-violating-the-civil-monetary-penalties-law-by-employing-an-excluded-individual/
"Windsor Laurelwood Center for Behavioral Medicine Agreed to Pay $104,000 for Allegedly Violating the Civil Monetary Penalties Law by Employing an Excluded Individual",2025-07-31,CIA Reportable Events,https://oig.hhs.gov/fraud/enforcement/windsor-laurelwood-center-for-behavioral-medicine-agreed-to-pay-104000-for-allegedly-violating-the-civil-monetary-penalties-law-by-employing-an-excluded-individual/
"Kidspeace National Centers of New England Agreed to Pay $44,000 for Allegedly Violating the Civil Monetary Penalties Law by Contracting with an Excluded Individual",2025-07-31,CMP and Affirmative Exclusions,https://oig.hhs.gov/fraud/enforcement/kidspeace-national-centers-of-new-england-agreed-to-pay-44000-for-allegedly-violating-the-civil-monetary-penalties-law-by-contracting-with-an-excluded-individual/
CEO and Medical Director Charged in $500 Million COVID-19 Test Billing Fraud,2025-07-31,COVID-19,https://oig.hhs.gov/fraud/enforcement/ceo-and-medical-director-charged-in-500-million-covid-19-test-billing-fraud/
Worcester Psychiatrist Sentenced for Unlawful Distribution of Controlled Substances,2025-07-31,Criminal and Civil Actions,https://oig.hhs.gov/fraud/enforcement/worcester-psychiatrist-sentenced-for-unlawful-distribution-of-controlled-substances/
"Florida Woman to Pay $400,000 to Settle Allegations of Falsifying Diagnoses in connection with an Amherst Compounding Pharmacy",2025-07-31,Criminal and Civil Actions,https://oig.hhs.gov/fraud/enforcement/florida-woman-to-pay-400000-to-settle-allegations-of-falsifying-diagnoses-in-connection-with-an-amherst-compounding-pharmacy/
Greensboro Woman Sentenced in Conviction with Multi-Million Dollar Urine Drug Testing Scheme,2025-07-31,Criminal and Civil Actions,https://oig.hhs.gov/fraud/enforcement/greensboro-woman-sentenced-in-conviction-with-multi-million-dollar-urine-drug-testing-scheme/
Illumina Inc. to Pay $9.8M to Resolve False Claims Act Allegations Arising from Cybersecurity Vulnerabilities in Genomic Sequencing Systems,2025-07-31,Criminal and Civil Actions,https://oig.hhs.gov/fraud/enforcement/illumina-inc-to-pay-98m-to-resolve-false-claims-act-allegations-arising-from-cybersecurity-vulnerabilities-in-genomic-sequencing-systems/
"Broken Arrow Dentist To Pay More Than $500,000 After False Claims Act Allegations",2025-07-31,State Enforcement Agencies,https://oig.hhs.gov/fraud/enforcement/broken-arrow-dentist-to-pay-more-than-500000-after-false-claims-act-allegations/
"Dermatology Providers Agree to Pay Nearly $850,000 to Resolve Allegations of False Wound Repair Claims",2025-07-30,Criminal and Civil Actions,https://oig.hhs.gov/fraud/enforcement/dermatology-providers-agree-to-pay-nearly-850000-to-resolve-allegations-of-false-wound-repair-claims/
AG Sunday’s Medicaid Fraud Control Section Charges Philadelphia Pharmacy in $2 Million Scheme Involving Sales of Unregulated HIV Medication,2025-07-30,State Enforcement Agencies,https://oig.hhs.gov/fraud/enforcement/ag-sundays-medicaid-fraud-control-section-charges-philadelphia-pharmacy-in-2-million-scheme-involving-sales-of-unregulated-hiv-medication/
Attorney General Griffin Announces Conviction of Lonoke Woman for Abuse of Adults,2025-07-29,State Enforcement Agencies,https://oig.hhs.gov/fraud/enforcement/attorney-general-griffin-announces-conviction-of-lonoke-woman-for-abuse-of-adults/
"NHC Healthcare – Burlington Agreed to Pay $31,000 for Allegedly Violating the Civil Monetary Penalties Law by Submitting Claims for Services Provided by an Unlicensed Individual",2025-07-28,Fraud Self-Disclosures,https://oig.hhs.gov/fraud/enforcement/nhc-healthcare-burlington-agreed-to-pay-31000-for-allegedly-violating-the-civil-monetary-penalties-law-by-submitting-claims-for-services-provided-by-an-unlicensed-individual/
"Urology Group of Florida Agreed to Pay $25,000 for Allegedly Violating the Civil Monetary Penalties Law by Employing an Excluded Individual",2025-07-28,Fraud Self-Disclosures,https://oig.hhs.gov/fraud/enforcement/urology-group-of-florida-agreed-to-pay-25000-for-allegedly-violating-the-civil-monetary-penalties-law-by-employing-an-excluded-individual/
Attorney General Griffin Announces Arrest of Trumann Man for Medicaid Fraud,2025-07-28,State Enforcement Agencies,https://oig.hhs.gov/fraud/enforcement/attorney-general-griffin-announces-arrest-of-trumann-man-for-medicaid-fraud/
"AG’s Office Secures Guilty Plea, Restitution From New Bedford Clinical Lab For MassHealth Fraud And Kickback Schemes",2025-07-28,State Enforcement Agencies,https://oig.hhs.gov/fraud/enforcement/ags-office-secures-guilty-plea-restitution-from-new-bedford-clinical-lab-for-masshealth-fraud-and-kickback-schemes/
"Flowers Hospital Agreed to Pay $150,000 for Allegedly Violating Patient Dumping Statute by Failing to Accept Appropriate Transfers",2025-07-25,CMP and Affirmative Exclusions,https://oig.hhs.gov/fraud/enforcement/flowers-hospital-agreed-to-pay-150000-for-allegedly-violating-patient-dumping-statute-by-failing-to-accept-appropriate-transfers/
Florida Man Sentenced To More Than 17 Years For Scheme To Steal More Than $10.8 Million From Medicare,2025-07-25,Criminal and Civil Actions,https://oig.hhs.gov/fraud/enforcement/florida-man-sentenced-to-more-than-17-years-for-scheme-to-steal-more-than-108-million-from-medicare/
Louisiana Nurse Practitioner Convicted Of $12 Million Medicare Fraud Scheme,2025-07-24,Criminal and Civil Actions,https://oig.hhs.gov/fraud/enforcement/louisiana-nurse-practitioner-convicted-of-12-million-medicare-fraud-scheme/
Attorney General Bonta Secures $1.53 Million Settlement with One of Nation’s Largest Hospital Systems for Unlawful Training Repayment Agreements with Nurses,2025-07-24,State Enforcement Agencies,https://oig.hhs.gov/fraud/enforcement/attorney-general-bonta-secures-153-million-settlement-with-one-of-nations-largest-hospital-systems-for-unlawful-training-repayment-agreements-with-nurses/
Attorney General Jeff Jackson Secures Over $200 Million from Gilead Sciences for Paying Kickbacks to Doctors,2025-07-23,State Enforcement Agencies,https://oig.hhs.gov/fraud/enforcement/attorney-general-jeff-jackson-secures-over-200-million-from-gilead-sciences-for-paying-kickbacks-to-doctors/
"United States Reaches $501,556 Civil Settlement Resolving Allegations of False Claims to Federal Health Care Programs",2025-07-22,Criminal and Civil Actions,https://oig.hhs.gov/fraud/enforcement/united-states-reaches-501556-civil-settlement-resolving-allegations-of-false-claims-to-federal-health-care-programs/
Trafficker Sent To Prison For Conspiring To Smuggle Toddler From Mexico,2025-07-22,Criminal and Civil Actions,https://oig.hhs.gov/fraud/enforcement/we-knocked-her-out-with-some-gummies-trafficker-sent-to-prison-for-conspiring-to-smuggle-toddler-from-mexico/
"Eye Consultants of Pennsylvania, PC Agrees To Pay $790,000.00 To Settle False Claims Act Allegations",2025-07-21,Criminal and Civil Actions,https://oig.hhs.gov/fraud/enforcement/eye-consultants-of-pennsylvania-pc-agrees-to-pay-79000000-to-settle-false-claims-act-allegations/
"Woodlands Senior Living of Cape Elizabeth Agreed to Pay $270,000 for Allegedly Violating the Civil Monetary Penalties Law by Employing an Excluded Individual",2025-07-21,Fraud Self-Disclosures,https://oig.hhs.gov/fraud/enforcement/woodlands-senior-living-of-cape-elizabeth-agreed-to-pay-270000-for-allegedly-violating-the-civil-monetary-penalties-law-by-employing-an-excluded-individual/
Attorney General Alan Wilson announces caregiver charged with beating vulnerable adult,2025-07-21,State Enforcement Agencies,https://oig.hhs.gov/fraud/enforcement/attorney-general-alan-wilson-announces-caregiver-charged-with-beating-vulnerable-adult/
Rossi Sentenced to an Additional Three Years in Prison for Health Care Fraud Related to COVID Testing,2025-07-18,COVID-19,https://oig.hhs.gov/fraud/enforcement/rossi-sentenced-to-an-additional-three-years-in-prison-for-healthcare-fraud-related-to-covid-testing/
New Jersey Doctor Charged With Distributing Opioids In Exchange For Sexual Favors And Defrauding New Jersey Medicaid,2025-07-18,Criminal and Civil Actions,https://oig.hhs.gov/fraud/enforcement/new-jersey-doctor-charged-with-distributing-opioids-in-exchange-for-sexual-favors-and-defrauding-new-jersey-medicaid/
"City of Fort Dodge Agreed to Pay $32,000 for Allegedly Violating the Civil Monetary Penalties Law by Submitting Claims for Services Provided by an Unlicensed Individual",2025-07-18,Fraud Self-Disclosures,https://oig.hhs.gov/fraud/enforcement/city-of-fort-dodge-agreed-to-pay-32000-for-allegedly-violating-the-civil-monetary-penalties-law-by-submitting-claims-for-services-provided-by-an-unlicensed-individual/
Attorney General James Uthmeier Announces Arrest of Bay County Woman for Exploiting Elderly Pensacola Man,2025-07-18,State Enforcement Agencies,https://oig.hhs.gov/fraud/enforcement/attorney-general-james-uthmeier-announces-arrest-of-bay-county-woman-for-exploiting-elderly-pensacola-man/
Attorney General Ken Paxton's Medicaid Fraud Control Unit Plays Key Role in Largest Dismantling of Health Care Fraud in U.S. History. U.S.,2025-07-18,State Enforcement Agencies,https://oig.hhs.gov/fraud/enforcement/attorney-general-ken-paxtons-medicaid-fraud-control-unit-plays-key-role-in-largest-dismantling-of-health-care-fraud-in-us-history-us/
"United States and the States of Georgia, Colorado, and South Carolina Obtain $114.5M in Judgments in a Sprawling Cancer Genetic Testing Lab Scheme",2025-07-17,Criminal and Civil Actions,https://oig.hhs.gov/fraud/enforcement/united-states-and-the-states-of-georgia-colorado-and-south-carolina-obtain-1145m-in-judgments-in-a-sprawling-cancer-genetic-testing-lab-scheme/
"Medfleet Agreed to Pay $81,000 for Allegedly Violating the Civil Monetary Penalties Law by Submitting Claims for Services Provided by an Improperly Licensed Emergency Medical Responder",2025-07-17,Fraud Self-Disclosures,https://oig.hhs.gov/fraud/enforcement/medfleet-agreed-to-pay-81000-for-allegedly-violating-the-civil-monetary-penalties-law-by-submitting-claims-for-services-provided-by-an-improperly-licensed-emergency-medical-responder/
"Attorney General Alan Wilson Announces Columbia Woman Charged With Stealing More Than $28,000 From Vulnerable Adult",2025-07-17,State Enforcement Agencies,https://oig.hhs.gov/fraud/enforcement/attorney-general-alan-wilson-announces-columbia-woman-charged-with-stealing-more-than-28000-from-vulnerable-adult/
Nevada Nurse Practitioner Pleads Guilty To Fraudulent Medicare Wound Care Billing,2025-07-16,Criminal and Civil Actions,https://oig.hhs.gov/fraud/enforcement/nevada-nurse-practitioner-pleads-guilty-to-fraudulent-medicare-wound-care-billing/
Florida Man Admits Role in $4.8 Million Health Care Fraud and Kickback Scheme,2025-07-16,Criminal and Civil Actions,https://oig.hhs.gov/fraud/enforcement/florida-man-admits-role-in-48-million-health-care-fraud-and-kickback-scheme/
"Former Iowa Nurse Sentenced to Federal Prison for Drug Diversion, Illegal Firearms Possession, and Bank Fraud",2025-07-16,Criminal and Civil Actions,https://oig.hhs.gov/fraud/enforcement/former-iowa-nurse-sentenced-to-federal-prison-for-drug-diversion-illegal-firearms-possession-and-bank-fraud/
AG Jennings Secures over $96K Settlement Following HIV Drug Kickback Investigation,2025-07-16,State Enforcement Agencies,https://oig.hhs.gov/fraud/enforcement/ag-jennings-secures-over-96k-settlement-following-hiv-drug-kickback-investigation/
Attorney General Raoul Announces More Than $200 Million Settlement With Gilead Sciences Over Illegal Kickbacks To Providers For Prescriptions,2025-07-16,State Enforcement Agencies,https://oig.hhs.gov/fraud/enforcement/attorney-general-raoul-announces-more-than-200-million-settlement-with-gilead-sciences-over-illegal-kickbacks-to-providers-for-prescriptions/
AG Campbell Announces Over $1 Million Settlement With Worcester County Transportation Provider For Defrauding MassHealth And Department Of Developmental Services,2025-07-16,State Enforcement Agencies,https://oig.hhs.gov/fraud/enforcement/ag-campbell-announces-over-1-million-settlement-with-worcester-county-transportation-provider-for-defrauding-masshealth-and-department-of-developmental-services/
Attorney General Dan Rayfield Helps Secure $202 Million Settlement with Gilead Over Kickback Scheme Involving HIV Medications,2025-07-16,State Enforcement Agencies,https://oig.hhs.gov/fraud/enforcement/attorney-general-dan-rayfield-helps-secure-202-million-settlement-with-gilead-over-kickback-scheme-involving-hiv-medications/
"Frankfort Regional Medical Center Agreed to Pay $110,000 for Allegedly Violating Patient Dumping Statute by Failing to Provide an Appropriate Medical Screening Examination",2025-07-15,CMP and Affirmative Exclusions,https://oig.hhs.gov/fraud/enforcement/frankfort-regional-medical-center-agreed-to-pay-110000-for-allegedly-violating-patient-dumping-statute-by-failing-to-provide-an-appropriate-medical-screening-examination/
Urgent Care Operator Pays $3 Million to Resolve Alleged Violations of the False Claims Act,2025-07-15,COVID-19,https://oig.hhs.gov/fraud/enforcement/urgent-care-operator-pays-3-million-dollars-to-resolve-alleged-violations-of-the-false-claims-act/
Health Care Worker Pleads Guilty to Double Billing District of Columbia Medicaid Programs,2025-07-15,Criminal and Civil Actions,https://oig.hhs.gov/fraud/enforcement/health-care-worker-pleads-guilty-to-double-billing-district-of-columbia-medicaid-programs/
Law Enforcement Recovers Over $6 Million in Forfeited Assets from Miami Couple Sentenced to 9- and 3-Year Prison Terms for Health Care Fraud and Money Laundering Conspiracies,2025-07-15,Criminal and Civil Actions,https://oig.hhs.gov/fraud/enforcement/law-enforcement-recovers-over-6-million-in-forfeited-assets-from-miami-couple-sentenced-to-9-and-3-year-prison-terms-for-health-care-fraud-and-money-laundering-conspiracies/
AG Campbell Secures $1.6 Million For Massachusetts In Multi-State Settlement With Pharmaceutical Company,2025-07-15,State Enforcement Agencies,https://oig.hhs.gov/fraud/enforcement/ag-campbell-secures-16-million-for-massachusetts-in-multi-state-settlement-with-pharmaceutical-company/
Attorney General Formella Helps Secure Over $200 Million from Gilead Sciences for Illegal Kickbacks,2025-07-15,State Enforcement Agencies,https://oig.hhs.gov/fraud/enforcement/attorney-general-formella-helps-secure-over-200-million-from-gilead-sciences-for-illegal-kickbacks/
Attorney General James Secures Over $200 Million from Gilead Sciences for Paying Illegal Kickbacks,2025-07-15,State Enforcement Agencies,https://oig.hhs.gov/fraud/enforcement/attorney-general-james-secures-over-200-million-from-gilead-sciences-for-paying-illegal-kickbacks/
AG Sunday Part of National Coalition Securing $200M+ from Gilead Sciences for Illegal Kickback Scheme to Sell HIV Drugs,2025-07-15,State Enforcement Agencies,https://oig.hhs.gov/fraud/enforcement/ag-sunday-part-of-national-coalition-securing-200m-from-gilead-sciences-for-illegal-kickback-scheme-to-sell-hiv-drugs/
California Man Pleads Guilty in Connection with $16M Hospice Fraud Scheme and Money Laundering Scheme,2025-07-14,Criminal and Civil Actions,https://oig.hhs.gov/fraud/enforcement/california-man-pleads-guilty-in-connection-with-16m-hospice-fraud-scheme-and-money-laundering-scheme/
Former Caregiver at Retirement Community in Ashtabula County Indicted on Rape Charges,2025-07-14,State Enforcement Agencies,https://oig.hhs.gov/fraud/enforcement/former-caregiver-at-retirement-community-in-ashtabula-county-indicted-on-rape-charges/
"Home Health Care Provider To Pay $334,807 To Settle False Claims Act Allegations",2025-07-11,Criminal and Civil Actions,https://oig.hhs.gov/fraud/enforcement/home-health-care-provider-to-pay-334807-to-settle-false-claims-act-allegations/
Raleigh County Physician Pleads Guilty to Federal Drug Crimes in Connection with HOPE Clinic,2025-07-11,Criminal and Civil Actions,https://oig.hhs.gov/fraud/enforcement/raleigh-county-physician-pleads-guilty-to-federal-drug-crimes-in-connection-with-hope-clinic/
"Corvallis Clinic Agreed to Pay $108,000 for Allegedly Violating the Civil Monetary Penalties Law by Paying and Receiving Remuneration in the Form of Referrals and Receiving Remuneration in the Form of Referral Fees",2025-07-11,Fraud Self-Disclosures,https://oig.hhs.gov/fraud/enforcement/corvallis-clinic-agreed-to-pay-108000-for-allegedly-violating-the-civil-monetary-penalties-law-by-paying-and-receiving-remuneration-in-the-form-of-referrals-and-receiving-remuneration-in-the-form-of-referral-fees/
"SPARC Network Agreed to Pay $181,000 for Allegedly Violating the Civil Monetary Penalties Law by Employing an Excluded Individual",2025-07-11,Fraud Self-Disclosures,https://oig.hhs.gov/fraud/enforcement/sparc-network-agreed-to-pay-181000-for-allegedly-violating-the-civil-monetary-penalties-law-by-employing-an-excluded-individual/
Attorney General Marshall Announces Conviction of Former Director of Nursing of Montgomery Nursing Home for Theft of Narcotics,2025-07-11,State Enforcement Agencies,https://oig.hhs.gov/fraud/enforcement/attorney-general-marshall-announces-conviction-of-former-director-of-nursing-of-montgomery-nursing-home-for-theft-of-narcotics/
"Andrew Gomes, MD Was Excluded for Defaulting on Payment Obligations",2025-07-10,CMP and Affirmative Exclusions,https://oig.hhs.gov/fraud/enforcement/andrew-gomes-md-was-excluded-for-defaulting-on-payment-obligations/
"UAB Medical West Agreed to Pay $100,000 for Allegedly Violating Patient Dumping Statue by Failing to Provide Stabilizing Treatment",2025-07-10,CMP and Affirmative Exclusions,https://oig.hhs.gov/fraud/enforcement/uab-medical-west-agreed-to-pay-100000-for-allegedly-violating-patient-dumping-statue-by-failing-to-provide-stabilizing-treatment/
Ohio Doctor Pleads Guilty to Role in Telemedicine Scheme,2025-07-10,Criminal and Civil Actions,https://oig.hhs.gov/fraud/enforcement/ohio-doctor-pleads-guilty-to-role-in-telemedicine-scheme/
Attorney General Griffin Announces Arrest of Paragould Woman for Medicaid Fraud,2025-07-10,State Enforcement Agencies,https://oig.hhs.gov/fraud/enforcement/attorney-general-griffin-announces-arrest-of-paragould-woman-for-medicaid-fraud/
9 Medicaid Providers Indicted on Fraud Charges,2025-07-10,State Enforcement Agencies,https://oig.hhs.gov/fraud/enforcement/9-medicaid-providers-indicted-on-fraud-charges/
Brant Jolly Agreed to Be Excluded for 10 Years for Allegedly Submitting False Claims for Lab Tests,2025-07-09,CMP and Affirmative Exclusions,https://oig.hhs.gov/fraud/enforcement/brant-jolly-agreed-to-be-excluded-for-10-years-for-allegedly-submitting-false-claims-for-lab-tests/
"1st Choice Healthcare Agreed to Pay $31,000 for Allegedly Violating the Civil Monetary Penalties Law by Submitting Claims for Chronic Care Management that Were Not Provided as Claimed",2025-07-09,Fraud Self-Disclosures,https://oig.hhs.gov/fraud/enforcement/1st-choice-healthcare-agreed-to-pay-31000-for-allegedly-violating-the-civil-monetary-penalties-law-by-submitting-claims-for-chronic-care-management-that-were-not-provided-as-claimed/
"MUSC Physicians Agreed to Pay $225,000 for Allegedly Violating the Civil Monetary Penalties Law by Submitting Claims for Psychotherapy that Were Not Provided as Claimed",2025-07-09,Fraud Self-Disclosures,https://oig.hhs.gov/fraud/enforcement/musc-physicians-agreed-to-pay-225000-for-allegedly-violating-the-civil-monetary-penalties-law-by-submitting-claims-for-psychotherapy-that-were-not-provided-as-claimed/
"Shasta View Care Center Agreed to Pay $41,000 for Allegedly Violating the Civil Monetary Penalties Law by Submitting Claims for Fraudulent Nursing Services",2025-07-09,Fraud Self-Disclosures,https://oig.hhs.gov/fraud/enforcement/shasta-view-care-center-agreed-to-pay-41000-for-allegedly-violating-the-civil-monetary-penalties-law-by-submitting-claims-for-fraudulent-nursing-services/
"St. Joseph Living Center Agreed to Pay $88,000 for Allegedly Violating the Civil Monetary Penalties Law by Employing an Excluded Individual",2025-07-09,Fraud Self-Disclosures,https://oig.hhs.gov/fraud/enforcement/st-joseph-living-center-agreed-to-pay-88000-for-allegedly-violating-the-civil-monetary-penalties-law-by-employing-an-excluded-individual/
Former Chief Operating Officer of Pain Care Centers Sentenced,2025-07-08,Criminal and Civil Actions,https://oig.hhs.gov/fraud/enforcement/jennifer-adams-to-serve-36-months-for-concealing-fraud-and-drug-conspiracies/
